text,category
Winter 2023 sunglasses for men and women,Ecommerce
India’s Premium English Learning Destination,Education
Gaming Power with Lenovo,Technology
Book unforgettable experience,Travel
Ultimate robot shooter,Other
Breaking news on the presidential election,News
The latest trends in healthcare technology,Healthcare
Investment tips for 2023,Finance
Top 10 travel destinations for 2023,Travel
Highlights from last night's game,Sports
Top movies to watch this weekend,Entertainment
Latest updates in the stock market,Finance
Health benefits of regular exercise,Healthcare
The new iPhone 13 release,Technology
Master Python programming in 30 days,Education
Exclusive deals on summer clothing,Ecommerce
Live concert happening this weekend,Entertainment
The future of artificial intelligence,Technology
New treatments for diabetes,Healthcare
Daily weather forecast,News
Learn English with the best tutors,Education
Best laptops for programming,Technology
Summer sale on electronics,Ecommerce
Latest breakthroughs in cancer research,Healthcare
Live sports events this weekend,Sports
How to save for retirement,Finance
Explore the world's best destinations,Travel
Breaking: Major political scandal,News
Top 10 movies to watch this year,Entertainment
A new kind of video game experience,Other
